{
  "identifier": "storefinder",
  "name": "Storefinder",
  "icon": "store",
  "fields": [
    {
      "label": "Name",
      "field": "name"
    }
  ],
  "schema": [
    {
      "name": "Base Data",
      "fields": [
        {
          "label": "Name",
          "field": "name",
          "required": true,
          "type": "string"
        },
        {
          "label": "Must not be ID",
          "field": "id",
          "type": "string"
        }
      ]
    }
  ],
  "indexes": []
}
