{
    "identifier": "disallowed_type_custom",
    "name": "disallowed_type_custom",
    "fields": [
        {
            "label": "Name",
            "field": "name"
        }
    ],
    "schema": [
        {
            "name": "Base Data",
            "fields": [
                {
                    "label": "Name",
                    "field": "name",
                    "type": "custom"
                }
            ]
        }
    ],
    "indexes": []
}
